{
  "seed_version": 1,
  "generated_at": "2026-05-20T00:00:00Z",
  "locale": "en-US",
  "topics": [
    {
      "slug": "bioluminescence",
      "title": "Bioluminescence",
      "summary": "Living things that make their own light, and the strange chemistry behind it.",
      "cover_asset_name": "TopicCover_Bioluminescence",
      "accent_color_hex": "#1B4D4A",
      "prompts": [
        {
          "slug": "deep-sea-glow",
          "body": "Why do so many deep-sea creatures glow blue rather than red? What does that tell you about the water above them?",
          "source": "ai-bootstrap",
          "tier": "free",
          "estimated_minutes": 10,
          "review": {
            "reviewed_by": "nadine",
            "reviewed_at": "2026-05-20T00:00:00Z",
            "ai_source_model": "gpt-4o",
            "notes": "Approved as-is. Considered swapping 'glow' for 'shine' but kept original."
          }
        },
        {
          "slug": "firefly-language",
          "body": "Fireflies flash in patterns. Pick one species and find out what its rhythm means.",
          "source": "ai-bootstrap",
          "tier": "free",
          "estimated_minutes": 12
        }
      ]
    },
    {
      "slug": "cartography",
      "title": "Old Maps",
      "summary": "What the world looked like to people who had never seen it from above.",
      "cover_asset_name": "TopicCover_Cartography",
      "accent_color_hex": "#2C1810",
      "prompts": [
        {
          "slug": "blank-spots",
          "body": "Find a map from before 1800. Look only at the parts that are blank or filled with drawings. What did the maker not know?",
          "source": "ai-bootstrap",
          "tier": "free",
          "estimated_minutes": 15
        }
      ]
    }
  ],
  "trails": [
    {
      "slug": "bioluminescence-intro",
      "topic_slug": "bioluminescence",
      "title": "A short walk through living light",
      "summary": "Two prompts that move from the deep sea to your backyard.",
      "steps": [
        { "step_order": 1, "prompt_slug": "deep-sea-glow", "estimated_minutes": 10 },
        { "step_order": 2, "prompt_slug": "firefly-language", "estimated_minutes": 12 }
      ]
    }
  ],
  "reminder_themes": [
    { "slug": "warm-paper", "display_name": "Warm Paper", "asset_name": "Reminder_WarmPaper" },
    { "slug": "deep-teal", "display_name": "Deep Teal", "asset_name": "Reminder_DeepTeal" }
  ],
  "redirect_methods": [
    { "slug": "read", "display_name": "Read", "summary": "Open a longer article or chapter instead of the next short post." },
    { "slug": "breath", "display_name": "Breath", "summary": "A two-minute breathing pattern before deciding what's next." },
    { "slug": "stretch", "display_name": "Stretch", "summary": "Stand up and move for the length of the timer." },
    { "slug": "journal", "display_name": "Journal", "summary": "Write a few sentences about what you were just looking for." }
  ]
}
